{
  "slug": "beispiel-automation",
  "archetype": "service-local-b2b",
  "mood": "Ruhig, editorial, lokal verankert — klares Gespräch, kein Startup-Pitch.",
  "color": {
    "background": "#E9EEF0",
    "foreground": "#132028",
    "accent": "#0D7A6F",
    "accent_hue": 174,
    "muted": "#4A5A62",
    "surface": "#DFE7EA",
    "selection": "#0D7A6F"
  },
  "typography": {
    "display": "Syne",
    "body": "Source Sans 3",
    "mono": "IBM Plex Mono",
    "forbidden": ["Inter", "Roboto", "Arial", "Poppins", "Open Sans"]
  },
  "layout": {
    "hero_budget": ["brand", "headline", "support", "cta_group", "dominant_visual"],
    "max_cards_per_section": 3,
    "prefer_asymmetric_splits": true,
    "full_bleed_hero": true
  },
  "motion": {
    "hero_entrance": "none",
    "intentional_motions": 3,
    "respect_reduced_motion": true
  },
  "anti_slop": {
    "rules": [
      "no_inter",
      "accent_hue_outside_200_290",
      "no_hero_cards",
      "no_fade_up_everywhere",
      "no_saas_filler_copy",
      "real_or_honest_imagery"
    ]
  }
}
